{
  "$schema": "../../../schemas/building_archetype.schema.json",
  "id": "main_hall",
  "name": "Main Hall",
  "description": "The central building of your base. Produces workers and advances through ages.",
  "category": "main_hall",
  "tier": 1,
  "size": {
    "width": 4,
    "height": 4
  },
  "health": 2000,
  "armor": 5,
  "cost": {
    "gold": 400,
    "wood": 200,
    "food": 0,
    "stone": 100,
    "mana": 0
  },
  "buildTime": 120,
  "requiredAge": 0,
  "providesPopulation": 10,
  "productionQueue": [
    {
      "type": "unit",
      "id": "worker",
      "requiredAge": 0
    },
    {
      "type": "tech",
      "id": "age_up_2",
      "requiredAge": 0
    },
    {
      "type": "tech",
      "id": "age_up_3",
      "requiredAge": 1
    },
    {
      "type": "tech",
      "id": "age_up_4",
      "requiredAge": 2
    }
  ],
  "resourceGeneration": {
    "goldPerSecond": 0,
    "woodPerSecond": 0,
    "foodPerSecond": 0,
    "stonePerSecond": 0,
    "manaPerSecond": 0,
    "requiresWorker": false,
    "workerCapacity": 0
  },
  "garrisonCapacity": 10,
  "attackCapability": {
    "canAttack": true,
    "damage": 15,
    "attackSpeed": 1.0,
    "attackRange": 8,
    "attackType": "pierce",
    "targetAir": true,
    "targetGround": true
  },
  "aura": {
    "radius": 15,
    "effect": "resource_dropoff",
    "value": 1,
    "affectsAllies": true,
    "affectsEnemies": false
  },
  "isUnique": true,
  "canRally": true,
  "canUpgrade": true,
  "upgradesTo": "main_hall_2",
  "visuals": {
    "model": "models/buildings/main_hall.fbx",
    "icon": "textures/icons/buildings/main_hall.png",
    "constructionStages": 4,
    "hasDestructionAnimation": true,
    "smokeWhenDamaged": true,
    "damageThreshold": 0.5
  }
}
